{
  "protocol_version": "2.0.0-draft",
  "message_kind": "transcode.progress",
  "message_id": "99999999-9999-7999-8999-000000000006",
  "sent_at": "2029-12-31T23:55:00.000Z",
  "audience": "hub:cell-test-a",
  "key_id": "test-wk2hub-k1",
  "identity": {
    "org_uuid": "11111111-1111-7111-8111-111111111111",
    "video_uuid": "22222222-2222-7222-8222-222222222222",
    "owning_cell_id": "cell-test-a",
    "placement_epoch": 7,
    "lifecycle_revision": 3,
    "attempt_id": "33333333-3333-7333-8333-333333333333",
    "dispatch_id": "44444444-4444-7444-8444-444444444444",
    "execution_id": "55555555-5555-7555-8555-555555555555",
    "execution_fence": 2
  },
  "event_seq": 5,
  "stage": "downloading",
  "stage_progress_pct": 10
}
